{
  "contract_version": "1.0",
  "worker_id": "sub1",
  "task_id": "explore-auth",
  "status": "success",
  "executive_summary": "Traced the full authentication flow. Sessions persist in localStorage without refresh token rotation. The global interceptor in api-client.ts handles token injection but has no expiration check.",
  "ownership": {
    "area": "src/auth/**",
    "touched_paths": ["src/auth/login.ts", "src/auth/session.ts", "src/lib/api-client.ts"],
    "untouched_paths": ["src/payments/**", "src/admin/**"]
  },
  "artifacts": {
    "created": [],
    "updated": [],
    "references": ["docs/auth-flow.md"]
  },
  "findings": [
    "Sessions persist in localStorage — vulnerable to XSS",
    "No refresh token rotation implemented",
    "Global interceptor in api-client.ts injects token but never checks expiration"
  ],
  "decisions": [
    "Do not touch payments module in this phase",
    "Focus on token lifecycle before session storage"
  ],
  "changes": [],
  "verification": {
    "performed": ["Code reading", "Flow tracing from login to API call", "Checked for token expiration logic"],
    "not_performed": ["Unit tests", "E2E flow execution", "Security audit"]
  },
  "risks": [
    "The interceptor is a global singleton — changes affect ALL API calls",
    "localStorage usage may be intentional for offline support — verify before replacing"
  ],
  "next_recommended": [
    "Implement refresh token rotation in session.ts",
    "Add token expiration check in api-client.ts interceptor",
    "Add test for session expiration edge case"
  ],
  "memory_saved": []
}
